τσμεδε,    ταμείο συντάξεων μηχανικών και εργοληπτών δημοσίων έργων
τσν,    ταμείο συντάξεως νομικών
τσπ ησαπ,    ταμείο συντάξεων προσωπικού ησαπ
ττ,    ταχυδρομικό ταμιευτήριο
τυδκ,    τεχνική υπηρεσία δήμων και κοινοτήτων
υδε,    υπηρεσίες δημοσιονομικού ελέγχου
υεβ,    υπηρεσία εγγείων βελτιώσεων
υεθα,     υπουργείο εθνικής άμυνας
υπα,    υπηρεσία πολιτικής αεροπορίας
υπαατ,    υπουργείο αγροτικής ανάπτυξης και τροφίμων
υπαδ,    υπηρεσία περίθαλψης ασφαλισμένων δημοσίου
υπεε,    υπηρεσία ειδικών ελέγχων
υπεθα,    υπουργείο εθνικής άμυνας
υπεθο,     υπουργείο εθνικής οικονομίας
υπεπθ,    υπουργείο εθνικής παιδείας και θρησκευμάτων
υπεχωδε,     υπουργείο περιβάλλοντος χωροταξίας και δημοσίων έργων
υποιο,     υπουργείο οικονομίας και οικονομικών
υππο,    υπουργείο πολιτισμού
υυκα,    υπουργείο υγείας και κοινωνικής αλληλεγγύης
φεκ,    φύλλο εφημερίδας της κυβερνήσεως
φκε,    φόρος κύκλου εργασιών
φμαπ,    φόρος μεγάλης ακίνητης περιουσίας
φμυ,     φόρος μισθωτών υπηρεσιών
φπα,    φόρος προστιθέμενης αξίας
χαα,    χρηματιστήριο αξιών αθηνών
χαδα,    χώροι ανεξέλεγκτης διάθεσης αποβλήτων
χεδ,    χρέος ενόπλων δυνάμεων
χμπα,    χρηματοδοτικό μέσο προσανατολισμού και αλιείας
χυκ,    χάρτης υποχρεώσεων καταναλωτή
dac,    development assistance committee (διμερής αναπτυξιακή βοήθεια)
emu,    european monetary union
esa,    european system accounts
feoga,    fonds europeen d’ orientation et de garantie agricde
icis,    integrated customs information system
nato,    north atlantic treaty organisation
olaf,    the european anti-fraud office
taxis,    tax information system
vies,    vat information exchange system
