aee,     ακαθάριστο εθνικό εισόδημα
αε,     ανώνυμη εταιρεία
αεδικ,     ανώνυμη εταιρεία διώρυγας κορίνθου
αει,     ανώτατα εκπαιδευτικά ιδρύματα
αεμυ,    ανώνυμη εταιρεία μονάδων υγείας
αεπ,     ακαθάριστο εγχώριο προϊόν
αμεα,     άτομα με ειδικές ανάγκες
ανυ,     ανάληψη νέων υποχρεώσεων
απε,    ανανεώσιμες πηγές ενέργειας
ασεπ,     ανώτατο συμβούλιο επιλογής προσωπικού
αστε,    ανώτερες σχολές τουριστικής εκπαίδευσης
ατε,     αγροτική τράπεζα της ελλάδος
αφμ,     αριθμός φορολογικού μητρώου
αχε,     ανώνυμος χρηματιστηριακή εταιρεία
βιπε,     βιομηχανική περιοχή
γγα,     γενική γραμματεία αθλητισμού
γγετ,     γενική γραμματεία έρευνας τεχνολογίας
γγοα,     γενική γραμματεία ολυμπιακών αγώνων
γγπς,     γενική γραμματεία πληροφοριακών συστημάτων
γδδε,    γενική διεύθυνση δημοσιονομικού ελέγχου
γδτκ,     γενικός δείκτης τιμών καταναλωτή
γκ,     γενική κυβέρνηση
γκπ,     γενικός κρατικός προϋπολογισμός
γλκ,     γενικό λογιστήριο του κράτους
γχκ,     γενικό χημείο του κράτους
δαα,     διεθνής αερολιμένας αθηνών
δεα,     διυπουργική επιτροπή αποκρατικοποιήσεων
δεη,     δημόσια επιχείρηση ηλεκτρισμού
δεθ,     διεθνής έκθεση θεσσαλονίκης
δεκα,     δημόσια επιχείρηση κινητών αξιών
δεκο,     δημόσιες επιχειρήσεις και οργανισμοί
δεπ,     δημόσια επιχείρηση πετρελαίου
δεπα,     δημόσια επιχείρηση αερίου
δεπανομ,     δημόσια επιχείρηση ανέγερσης νοσηλευτικών μονάδων
δεπος,"     δημόσια επιχείρηση πολεοδόμησης, οικισμού, στέγασης"
δεσμηε,    διαχειριστής ελληνικού συστήματος μεταφοράς ηλεκτρικής ενέργειας
δεσφα,    διαχειριστής εθνικού συστήματος φυσικού αερίου
δευα,     δημοτική επιχείρηση ύδρευσης αποχέτευσης
δεφα,     δημόσια επιχείρηση φυσικού αερίου
δντ,     διεθνές νομισματικό ταμείο
δου,     δημόσια οικονομική υπηρεσία
δτκ,     δείκτης τιμών καταναλωτή
δτχ,     δείκτης τιμών χονδρικής
δυπε,     διεύθυνση υγειονομικής περιφέρειας
δχ,     δημόσιας χρήσης
εαβ,     ελληνική αεροπορική βιομηχανία
εαντ,     εταιρεία ανάπτυξης ναυτικής τεχνολογίας
εας,     ελληνικά αμυντικά συστήματα
εαχα,    ενοποίηση αρχαιολογικών χώρων αθήνας
εβεταμ,     εταιρεία βιομηχανικής εκμετάλευσης και τεχνολογικής ανάπτυξης μετάλλων
εγλς,     ενιαίο γενικό λογιστικό σχέδιο
εγσσε,     εθνική γενική συλλογική σύμβαση εργασίας
εγταα,    ευρωπαϊκό γεωργικό ταμείο αγροτικής ανάπτυξης
εγτε,    ευρωπαϊκό γεωργικό ταμείο εγγυήσεων
εγτπε,     ευρωπαϊκό γεωργικό ταμείο προσανατολισμού-εγγυήσεων
εδ,     ελληνικό δημόσιο
εδ,     ένοπλες δυνάμεις
εδελ,     επιτροπή δημοσιονομικού ελέγχου
εδετ,     εθνικό δίκτυο έρευνας και τεχνολογίας
εδισυ,     εθνικός διαχειριστής σιδηροδρομικής υποδομής
εδτκ,    εναρμονισμένος δείκτης τιμών καταναλωτή
εε,     ετερόρρυθμη εταιρεία
εε,     ευρωπαϊκή ένωση
εε,     ευρωπαϊκή επιτροπή
εες,     ελληνικός ερυθρός σταυρός
εεταα,     ελληνική εταιρεία τοπικής ανάπτυξης και αυτοδιοίκησης
εεττ,     εθνική επιτροπή τηλεπικοινωνιών και ταχυδρομείων
εζες,    ευρωπαϊκή ζώνη ελευθέρων συναλλαγών
εθεκ,     εθνικά ελεγκτικά κέντρα
εθελ,     εταιρεία θερμικών λεωφορείων
ειαα,     εθνικό ίδρυμα αποκατάστασης αναπήρων
ειν,     εθνικό ίδρυμα νεότητας
ειπκ,     εθνικό ίδρυμα προστασίας κωφαλάλων
ειυαποε,     εθνικό ίδρυμα υποδοχής και αποκατάστασης παλ/ντων ομογενών ελλήνων
εκαβ,     εθνικό κέντρο άμεσης βοήθειας
εκακβ,     εθνικό κέντρο άμεσης κοινωνικής βοήθειας
εκας,     επίδομα κοινωνικής αλληλεγγύης συνταξιούχων
εκαχ,     ευρωπαϊκή κοινότητα άνθρακα – χάλυβα
εκεβυλ,    ερευνητικό κέντρο βιολογικών υλικών αε
εκεπις,     εθνικό κέντρο πιστοποίησης
εκεπυ,     εταιρεία κεραμικών και πυριμάχων
εκεφε,     εθνικό κέντρο έρευνας φυσικών επιστημών
εκκ,    ελληνικό κέντρο κινηματογράφου αε
εκο,    ελληνικά καύσιμα ορυκτέλαια
εκσεδ,    ενιαίο κέντρο συντονισμού έρευνας και διάσωσης
εκτ,    ευρωπαϊκό κοινωνικό ταμείο
εκτ,    ευρωπαϊκή κεντρική τράπεζα
ελας,    ελληνική αστυνομία
ελβιονυ,    ελληνική βιομηχανία νοσοκομειακού υλικού αε
ελβο,    ελληνική βιομηχανία οχημάτων
ελγα,    ελληνικές γεωργικές ασφαλίσεις
ελδα,    ελληνικά διυλιστήρια ασπροπύργου
ελεβμε,    ελληνική εταιρεία βιομηχανικών και μεταλλευτικών επενδύσεων
ελεγεπ,    ειδικός λογαριασμός εγγυήσεων γεωργικών προϊόντων
ελια,    ελληνικό λογοτεχνικό και ιστορικό αρχείο
ελκα,    ελληνικό κέντρο αργυροχρυσοχοΐας αε
ελκε,    ελληνικό κέντρο επενδύσεων
ελκεα,    ελληνικό κέντρο αργυλομάζης αε
ελοτ,    ελληνικός οργανισμός τυποποίησης
ελπε,    ελληνικά πετρέλαια
ελσι,    ελληνικά σιδηροκράματα
ελτα,    ελληνικά ταχυδρομεία
εμπαε,    ενιαίο μεσοπρόθεσμο πρόγραμμα ανάπτυξης εκσυγχρονισμού
εναε,    ένωση νομαρχιακών αυτοδιοικήσεων ελλάδας
εομμεχ,    εθνικός οργανισμός μικρομεσαίων μεταποιητικών επιχ/σεων και χειροτεχνίας
εοτ,    ελληνικός οργανισμός τουρισμού
εοφ,    εθνικός οργανισμός φαρμάκων
επ,    επιχειρησιακό πρόγραμμα
επα,    εθνικό πρόγραμμα ανάπτυξης
επαα,    έγγραφο προγραμματισμού αγροτικής ανάπτυξης
επακατ,    επαγγελματική κατάρτιση αε
επαλ,    επαγγελματικά λύκεια
επαν,    επιχειρησιακό πρόγραμμα ανταγωνιστικότητας
επας,    επαγγελματικές σχολές
επε,    εταιρεία περιορισμένης ευθύνης
επεαεκ,    επιχειρησιακό πρόγραμμα εκπαίδευσης και αρχικής επαγ/κής κατάρτισης
επεπ,    εθνικό πρόγραμμα επικοινωνιακής πολιτικής
επευ,    εταιρεία παροχής επενδυτικών υπηρεσιών
επυ,    εθελοντές πενταετούς υποχρέωσης
ερτ,    ελληνική ραδιοφωνία τηλεόραση
εσεπει,    εθνικό σύστημα ελεύθερης επιλογής ιατρών
εσλ,    ευρωπαϊκό σύστημα λογαριασμών
εσοαβ,    εθνικό σχέδιο για την ανασυγκρότηση των βαλκανίων
εσοε,    ειδικό συντονιστικό όργανο ελέγχου
εσπ,    εθνικό σχέδιο προγραμμάτων
εσπα,    εθνικό στρατηγικό πλαίσιο αναφοράς
εσυ,    εθνικό σύστημα υγείας
εσυε,    εθνική στατιστική υπηρεσία ελλάδας
εσυκφ,    εθνικό συμβούλιο κοινωνικής φροντίδας
εσυλ,    εθνικό συμβούλιο λογιστικής
εσυπ,    εθνικό συμβούλιο παιδείας
εσφα,    εθνικό σύστημα φυσικού αερίου
ετα,    επιχειρήσεις τουριστικών ακινήτων
ετακει,    εταιρεία τεχνολογικής ανάπτυξης κλωστοϋφαντουργίας ένδυσης και ινών
εταμ,    ενιαίο ταμείο μισθωτών
ετατ,    εταιρεία τεχνολογικής ανάπτυξης τροφίμων
ετβα,    εθνική τράπεζα βιομηχανικής ανάπτυξης
"ετε
ετε","    ευρωπαϊκή τράπεζα επενδύσεων
"
ετεαμ,    ενιαίο ταμείο επικουρικής ασφάλισης μισθωτών
ετερπς,    ειδικό ταμείο εφαρμογής ρυθμιστικών και πολεοδομικών σχεδίων
ετμοα,    ειδικό ταμείο μονίμων οδοστρωμάτων αθηνών
ετπα,    ευρωπαϊκό ταμείο περιφερειακής ανάπτυξης
ευαθ,    εταιρεία ύδρευσης αποχέτευσης θεσσαλονίκης
ευδαπ,    εταιρεία ύδρευσης αποχέτευσης πρωτευούσης
ευπ,    εθνική υπηρεσία πληροφοριών
εφετ,    ενιαίος φορέας ελέγχου τροφίμων
εφκ,    ειδικός φόρος κατανάλωσης
εφτε,    ειδικός φόρος τραπεζικών εργασιών
εχαε,    ελληνικά χρηματιστήρια αε
ηδατ,    ηλεκτρονική δευτερογενής αγορά τίτλων
ηλπαπ,    ηλεκτρικά λεωφορεία περιοχής αθήνας – πειραιά
ησαπ,    ηλεκτρικοί σιδηρόδρομοι αθήνας – πειραιά
ιεκ,    ινστιτούτο επαγγελματικής κατάρτισης
ικα,    ίδρυμα κοινωνικών ασφαλίσεων
ικυ,    ίδρυμα  κρατικών υποτροφιών
ινθυαε,    ινστιτούτο έρευνας νοσημάτων θώρακος υγιεινής και ασφάλειας της εργασίας
ιοβε,    ινστιτούτο οικονομικών και βιομηχανικών ερευνών
ιοκ,    ινστιτούτο οικονομίας κατασκευών
ιτσακ,    ινστιτούτο τεχνικής σεισμολογίας & αντισεισμικών κατασκευών
ιφετ,    ινστιτούτο φαρμακευτικής έρευνας και τεχνολογίας
ιχθυκα,    ιχθυοκαλλιεργητικό κέντρο αχελώου
κααν,    κεφάλαιο ανεργίας και ασθένειας ναυτικών
καε,    καταστήματα αφορολογήτων ειδών
καθ,    κεντρική αγορά θεσσαλονίκης
καπ καπ,"    κοινή αγροτική πολιτική
"
καπε,    κέντρο ανανεώσιμων πηγών ενέργειας
κβς,     κώδικας βιβλίων στοιχείων
κδαυ,    κέντρα διάγνωσης αξιολόγησης υποστήριξης
κεαδ,    κεντρική επιτροπή απλούστευσης διαδικασιών
κεγ,    κέντρο ελληνικής γούνας αε
κεδ,     κτηματική εταιρεία του δημοσίου
κεδκε,     κεντρική ένωση δήμων και κοινοτήτων ελλάδος
κεελ,     κέντρο ελέγχου ειδικών λοιμώξεων
κεελπνο,     κέντρο ελέγχου και πρόληψης νοσημάτων
κεθεα,     κέντρο θεραπείας εξαρτημένων ατόμων
κεπ,    κέντρο εξυπηρέτησης πολιτών
κεπατ,    κέντρα προπονητικού και αθλητικού τουρισμού
κεπε,     κέντρο προγραμματισμού και ερευνών
κεπυο,     κέντρο πληροφορικής υπουργείου οικονομικών
κεσυτ,    κεφάλαιο επιχειρηματικών συμμετοχών υψηλής τεχνολογίας
κετα,    κέντρα επιχειρηματικής και τεχνολογικής ανάπτυξης
κθβε,     κρατικό θέατρο βορείου ελλάδος
κκ,     κεντρική κυβέρνηση
κοκ,     κώδικας οδικής κυκλοφορίας
κπ,     κρατικός προϋπολογισμός
κπα,    κέντρο προώθησης απασχόλησης
κπς κπς,"     κοινοτικό πλαίσιο στήριξης
"
κτγκ & δ,     κεντρικό ταμείο γεωργίας κτηνοτροφίας και δασών
κτεο,     κέντρο τεχνικού ελέγχου οχημάτων
κτπ,     κοινωνία της πληροφορίας
κυα,    κοινή υπουργική απόφαση
κυε,     κέντρο υποδοχής επενδυτών
κυσεα,     κυβερνητικό συμβούλιο εξωτερικών και άμυνας
λαφκα,     λογαριασμός αλληλεγγύης φορέων κοινωνικής ασφάλισης
λς,     λιμενικό σώμα
μα-βε,    μεταλλεία αμιάντου β. ελλάδος
ματυ,     μονάδα ανάλυσης και τεχνικής υποστήριξης
μεα,     μόνιμη ελληνική αντιπροσωπεία
μεβη,    μεταλλουργική βιομηχανία ηπείρου αε
μεδ,     μη επαναλαμβανόμενες δαπάνες
μεθ,     μονάδες εντατικής θεραπείας
μμε,     μέσα μαζικής ενημέρωσης
μοπ,     μεσογειακά ολοκληρωμένα προγράμματα
μσι,     μηχανισμός συναλλαγματικών ισοτιμιών
μτπυ,     μετοχικό ταμείο πολιτικών υπαλλήλων
να,     νομαρχιακή αυτοδιοίκηση
ναεδκ,     νέα ανώνυμος εταιρεία διώρυγας κορίνθου
νατ,     ναυτικό απομαχικό ταμείο
νατ (κααν),     ναυτικό απομαχικό ταμείο (κεφάλαιο ανεργίας & ασθένειας ναυτικών)
νεε,     νέοι ελεύθεροι επαγγελματίες
νελε,     νομαρχιακές επιτροπές λαϊκής επιμόρφωσης
νιμτς,     νοσηλευτικό ίδρυμα μετοχικού ταμείου στρατού
νπδδ,     νομικό πρόσωπο δημοσίου δικαίου
νπιδ,     νομικό πρόσωπο ιδιωτικού δικαίου
νσκ,     νομικό συμβούλιο του κράτους
νχι,     νομισματικά χρηματοπιστωτικά ιδρύματα
"οα
οα","     ολυμπιακή αεροπορία
"
οαε,     οργανισμός ανασυγκρότησης επιχειρήσεων
οαεδ,     οργανισμός απασχόλησης εργατικού δυναμικού
οαεε,     οργανισμός ασφάλισης ελευθέρων επαγγελμάτων
οαθ,     οργανισμός αποχέτευσης θεσσαλονίκης
οαπ-δεη,     οργανισμός ασφάλισης προσωπικού δεη
οασα,     οργανισμός αστικών συγκοινωνιών αθηνών
οασθ,     οργανισμός αστικών συγκοινωνιών θεσσαλονίκης
οασπ,    οργανισμός αντισεισμικού σχεδιασμού & προστασίας
ογα,     οργανισμός γεωργικών ασφαλίσεων
ογεεκα,"     οργανισμός     γεωργικής     επαγγελματικής     εκπαίδευσης,     κατάρτισης     και
απασχόλησης"
οδδηχ,    οργανισμός διαχείρισης δημόσιου χρέους
οδδυ,     οργανισμός διαχείρισης δημόσιου υλικού
οδιε,     οργανισμός διεξαγωγής ιπποδρομιών ελλάδος
οεδβ,     οργανισμός έκδοσης διδακτικών βιβλίων
οεε,     οικονομικό επιμελητήριο ελλάδος
οεε,     οργανισμός εργατικής εστίας
οεκ,     οργανισμός εργατικής κατοικίας
οεοα,     οργανισμός επιτροπής ολυμπιακών αγώνων
οηε,     οργανισμός ηνωμένων εθνών
οκα,     οργανισμοί κοινωνικής ασφάλισης
οκαα,     οργανισμός κεντρικής αγοράς αθηνών
οκανα,    οργανισμός κατά των ναρκωτικών
οκαπ,    οργανισμοί κοινωνικής ασφάλισης και πρόνοιας
οκε,    οικονομική και κοινωνική επιτροπή
οκχε,    οργανισμός κτηματολογίου και χαρτογραφήσεων ελλάδος
ολα,    οργανισμός λιμένος αλεξανδρούπολης
ολε,    οργανισμός λιμένος ελευσίνας
ολη,    οργανισμός λιμένος ηρακλείου
οληγ,    οργανισμός λιμένος ηγουμενίτσας
ολθ,    οργανισμός λιμένος θεσσαλονίκης
ολκ,    οργανισμός λιμένος καβάλας
ολκε,    οργανισμός λιμένος κέρκυρας
ολλ,    οργανισμός λιμένος λαυρίου
ολπ,    οργανισμός λιμένος πειραιώς
ολπα,    οργανισμός λιμένος πατρών
ολρ,    οργανισμός λιμένος ραφήνας
ονε,    οικονομική νομισματική ένωση
οοσα,    οργανισμός οικονομικής συνεργασίας και ανάπτυξης
οπαδ,    οργανισμός περίθαλψης ασφαλισμένων δημοσίου
οπαπ,    οργανισμός προγνωστικών αγώνων ποδοσφαίρου
οπε,    οργανισμός προώθησης εξαγωγών
οπεγεπ,    οργανισμός πιστοποίησης και επίβλεψης γεωργικών προϊόντων
οπεκ,    οργανισμός πετρελαιοπαραγωγών κρατών
οπεκεπε,"    οργανισμός πληρωμών & ελέγχου κοινοτικών ενισχύσεων προσανατολισμού &
εγγυήσεων"
οπεπ,    οργανισμός προβολής ελληνικού πολιτισμού
οπιλογ,    οργανισμός πιστοποίησης λογαριασμών
οπς,    ολοκληρωμένο πληροφοριακό σύστημα
οπσδπ,    ολοκληρωμένο πληροφοριακό σύστημα δημοσιονομικής πολιτικής
οπστ,     ολοκληρωμένο πληροφορικό σύστημα τελωνείων
οσε,    οργανισμός σιδηροδρόμων ελλάδας
οσκ,    οργανισμός σχολικών κτιρίων
οτα,    οργανισμοί τοπικής αυτοδιοίκησης
οτε,    οργανισμός τηλεπικοινωνιών ελλάδος
οτεκ,    οργανισμός τουριστικής εκπαίδευσης και κατάρτισης
ουθ,    οργανισμός ύδρευσης θεσσαλονίκης
παεπ,    παρατηρητήριο απασχόλησης ερευνητική πληροφορική
πδ,    προεδρικό διάταγμα
πδε,    πρόγραμμα δημόσιων επενδύσεων
πεκ,    περιφερειακά ελεγκτικά κέντρα
πεκ,    περιφερειακά επιμορφωτικά κέντρα
πεπ,     περιφερειακά επιχειρησιακά προγράμματα
πεσυ,     περιφερειακό σύστημα υγείας
ποε,    παρελθόντα οικονομικά έτη
ποε,    παγκόσμιος οργανισμός εμπορίου
ποπς,    πανελλήνια ομοσπονδία πολιτικών συνταξιούχων
πς,    πυροσβεστικό σώμα
πσα,     πρόγραμμα σταθερότητας και ανάπτυξης
πσεα,     πολιτική σχεδίαση έκτακτης ανάγκης
πσεες,     πληροφοριακό σύστημα ενημέρωσης και εξυπηρέτησης συνταξιούχων
πυς,     πράξη υπουργικού συμβουλίου
σαεπ,    συλλογική απόφαση έργων περιφέρειας
σανα,    συλλογική απόφαση νομαρχιακής αυτοδιοίκησης
σατ,   σύστημα άϋλων τίτλων
σατα,    συλλογική απόφαση τοπικής αυτοδιοίκησης
σδε,    σώμα δημοσιονομικών ελεγκτών
σδιτ,    σύμπραξη δημόσιου και ιδιωτικού τομέα
σεε,    σύνολο ετήσιων εκμεταλλεύσεων
σεκ,    συνεχιζόμενη επαγγελματική κατάρτιση
σεπε,    σώμα επιθεωρητών εργασίας
σευυο,    σχολή επιμόρφωσης υπαλλήλων υπουργείου οικονομικών
σκα,    σιδηροδρομικό κέντρο αχαρνών
σολπ,    σύστημα ολικής λογιστικής παρακολούθησης
σπα,    σχέδιο περιφερειακής ανάπτυξης
στεπ,    σταθμός εξυπηρέτησης πολιτών
συνελ,    συνεταιριστική εταιρεία λιπασμάτων
ταε,    ταμείο ασφαλίσεως εμπόρων
τακε,    ταμείο κληρικών ελλάδος
τασε,     ταμείο ανάπτυξης συμβουλίου ευρώπης
ταχδικ,    ταμείο χρηματοδοτήσεως δικαστικών κτιρίων
τε,    τράπεζα ελλάδος
τεαα,    τέλη εκσυγχρονισμού και ανάπτυξης αεροδρομίων
τεαυφε,    ταμείο επικουρικής ασφάλισης υπαλλήλων φαρμακευτικών εταιρειών
τεβε,    ταμείο επαγγελματιών και βιοτεχνών ελλάδος
τεε,    τεχνικά επαγγελματικά εκπαιδευτήρια
τεθα,    ταμείο εθνικής άμυνας
τει,    τεχνολογικά εκπαιδευτικά ιδρύματα
τεκ,    τοπικά ελεγκτικά κέντρα
τεμπμε,    ταμείο εγγυοδοσίας μικρών και πολύ μικρών επιχειρήσεων
τεο,    ταμείο εθνικής οδοποιίας
τκασε,    ταμείο κοινωνικής ανάπτυξης συμβουλίου ευρώπης
τπ,    τακτικός προϋπολογισμός
τπδ,    ταμείο παρακαταθηκών και δανείων
τπε,    τεχνολογίες πληροφορικής και επικοινωνιών
τσα,    ταμείο συντάξεων αυτοκινητιστών
τσαυ,    ταμείο συντάξεως και αυτασφάλισης υγειονομικών
